{
  "$comment": "The development reference rig (spec 110). Same bone contract as biped.skeleton.json, but with a MEASURED bind pose, because this rig was drawn here rather than generated. The canonical skeleton stays provisional until a real Tripo rig is measured against it -- filling it in from this one would defeat the check it exists to make. Renamed from `biped-dev` in spec 139: `biped` now names the one family real bodies animate on, and two near-identical names on two different naming specs was the confusion. This is the dev reference mannequin's family and nothing ships against it.",
  "formatVersion": 1,
  "id": "mannequin-dev",
  "naming": "mixamo",
  "upAxis": "+Y",
  "forwardAxis": "+X",
  "canonicalHeight": 55.65,
  "boneBudget": {
    "min": 15,
    "max": 30
  },
  "bones": [
    {
      "name": "mixamorig:Hips",
      "parent": null
    },
    {
      "name": "mixamorig:Spine",
      "parent": "mixamorig:Hips"
    },
    {
      "name": "mixamorig:Spine1",
      "parent": "mixamorig:Spine"
    },
    {
      "name": "mixamorig:Spine2",
      "parent": "mixamorig:Spine1"
    },
    {
      "name": "mixamorig:Neck",
      "parent": "mixamorig:Spine2"
    },
    {
      "name": "mixamorig:Head",
      "parent": "mixamorig:Neck"
    },
    {
      "name": "mixamorig:HeadTop_End",
      "parent": "mixamorig:Head"
    },
    {
      "name": "mixamorig:LeftShoulder",
      "parent": "mixamorig:Spine2"
    },
    {
      "name": "mixamorig:LeftArm",
      "parent": "mixamorig:LeftShoulder"
    },
    {
      "name": "mixamorig:LeftForeArm",
      "parent": "mixamorig:LeftArm"
    },
    {
      "name": "mixamorig:LeftHand",
      "parent": "mixamorig:LeftForeArm"
    },
    {
      "name": "mixamorig:RightShoulder",
      "parent": "mixamorig:Spine2"
    },
    {
      "name": "mixamorig:RightArm",
      "parent": "mixamorig:RightShoulder"
    },
    {
      "name": "mixamorig:RightForeArm",
      "parent": "mixamorig:RightArm"
    },
    {
      "name": "mixamorig:RightHand",
      "parent": "mixamorig:RightForeArm"
    },
    {
      "name": "mixamorig:LeftUpLeg",
      "parent": "mixamorig:Hips"
    },
    {
      "name": "mixamorig:LeftLeg",
      "parent": "mixamorig:LeftUpLeg"
    },
    {
      "name": "mixamorig:LeftFoot",
      "parent": "mixamorig:LeftLeg"
    },
    {
      "name": "mixamorig:LeftToeBase",
      "parent": "mixamorig:LeftFoot"
    },
    {
      "name": "mixamorig:LeftToe_End",
      "parent": "mixamorig:LeftToeBase"
    },
    {
      "name": "mixamorig:RightUpLeg",
      "parent": "mixamorig:Hips"
    },
    {
      "name": "mixamorig:RightLeg",
      "parent": "mixamorig:RightUpLeg"
    },
    {
      "name": "mixamorig:RightFoot",
      "parent": "mixamorig:RightLeg"
    },
    {
      "name": "mixamorig:RightToeBase",
      "parent": "mixamorig:RightFoot"
    },
    {
      "name": "mixamorig:RightToe_End",
      "parent": "mixamorig:RightToeBase"
    }
  ],
  "sockets": [
    {
      "id": "weapon.main",
      "bone": "mixamorig:RightHand"
    },
    {
      "id": "weapon.off",
      "bone": "mixamorig:LeftHand"
    },
    {
      "id": "fx.cast",
      "bone": "mixamorig:RightHand"
    },
    {
      "id": "fx.body",
      "bone": "mixamorig:Spine2"
    },
    {
      "id": "anchor.head",
      "bone": "mixamorig:Head"
    }
  ],
  "bindPose": {
    "source": "mannequin.glb",
    "bones": [
      {
        "name": "mixamorig:Hips",
        "translation": [
          0,
          0.95,
          0
        ],
        "rotation": [
          0,
          0,
          0,
          1
        ],
        "scale": [
          1,
          1,
          1
        ]
      },
      {
        "name": "mixamorig:Spine",
        "translation": [
          0,
          0.1,
          0
        ],
        "rotation": [
          0,
          0,
          0,
          1
        ],
        "scale": [
          1,
          1,
          1
        ]
      },
      {
        "name": "mixamorig:Spine1",
        "translation": [
          0,
          0.11,
          0
        ],
        "rotation": [
          0,
          0,
          0,
          1
        ],
        "scale": [
          1,
          1,
          1
        ]
      },
      {
        "name": "mixamorig:Spine2",
        "translation": [
          0,
          0.11,
          0
        ],
        "rotation": [
          0,
          0,
          0,
          1
        ],
        "scale": [
          1,
          1,
          1
        ]
      },
      {
        "name": "mixamorig:Neck",
        "translation": [
          0,
          0.13,
          0
        ],
        "rotation": [
          0,
          0,
          0,
          1
        ],
        "scale": [
          1,
          1,
          1
        ]
      },
      {
        "name": "mixamorig:Head",
        "translation": [
          0,
          0.09,
          0
        ],
        "rotation": [
          0,
          0,
          0,
          1
        ],
        "scale": [
          1,
          1,
          1
        ]
      },
      {
        "name": "mixamorig:HeadTop_End",
        "translation": [
          0,
          0.23,
          0
        ],
        "rotation": [
          0,
          0,
          0,
          1
        ],
        "scale": [
          1,
          1,
          1
        ]
      },
      {
        "name": "mixamorig:LeftShoulder",
        "translation": [
          0,
          0.1,
          -0.05
        ],
        "rotation": [
          0,
          0,
          0,
          1
        ],
        "scale": [
          1,
          1,
          1
        ]
      },
      {
        "name": "mixamorig:LeftArm",
        "translation": [
          0,
          0,
          -0.13
        ],
        "rotation": [
          0,
          0,
          0,
          1
        ],
        "scale": [
          1,
          1,
          1
        ]
      },
      {
        "name": "mixamorig:LeftForeArm",
        "translation": [
          0,
          0,
          -0.26
        ],
        "rotation": [
          0,
          0,
          0,
          1
        ],
        "scale": [
          1,
          1,
          1
        ]
      },
      {
        "name": "mixamorig:LeftHand",
        "translation": [
          0,
          0,
          -0.24
        ],
        "rotation": [
          0,
          0,
          0,
          1
        ],
        "scale": [
          1,
          1,
          1
        ]
      },
      {
        "name": "mixamorig:RightShoulder",
        "translation": [
          0,
          0.1,
          0.05
        ],
        "rotation": [
          0,
          0,
          0,
          1
        ],
        "scale": [
          1,
          1,
          1
        ]
      },
      {
        "name": "mixamorig:RightArm",
        "translation": [
          0,
          0,
          0.13
        ],
        "rotation": [
          0,
          0,
          0,
          1
        ],
        "scale": [
          1,
          1,
          1
        ]
      },
      {
        "name": "mixamorig:RightForeArm",
        "translation": [
          0,
          0,
          0.26
        ],
        "rotation": [
          0,
          0,
          0,
          1
        ],
        "scale": [
          1,
          1,
          1
        ]
      },
      {
        "name": "mixamorig:RightHand",
        "translation": [
          0,
          0,
          0.24
        ],
        "rotation": [
          0,
          0,
          0,
          1
        ],
        "scale": [
          1,
          1,
          1
        ]
      },
      {
        "name": "mixamorig:LeftUpLeg",
        "translation": [
          0,
          -0.05,
          -0.09
        ],
        "rotation": [
          0,
          0,
          0,
          1
        ],
        "scale": [
          1,
          1,
          1
        ]
      },
      {
        "name": "mixamorig:LeftLeg",
        "translation": [
          0,
          -0.42,
          0
        ],
        "rotation": [
          0,
          0,
          0,
          1
        ],
        "scale": [
          1,
          1,
          1
        ]
      },
      {
        "name": "mixamorig:LeftFoot",
        "translation": [
          0,
          -0.4,
          0
        ],
        "rotation": [
          0,
          0,
          0,
          1
        ],
        "scale": [
          1,
          1,
          1
        ]
      },
      {
        "name": "mixamorig:LeftToeBase",
        "translation": [
          0.08,
          -0.07,
          0
        ],
        "rotation": [
          0,
          0,
          0,
          1
        ],
        "scale": [
          1,
          1,
          1
        ]
      },
      {
        "name": "mixamorig:LeftToe_End",
        "translation": [
          0.08,
          0,
          0
        ],
        "rotation": [
          0,
          0,
          0,
          1
        ],
        "scale": [
          1,
          1,
          1
        ]
      },
      {
        "name": "mixamorig:RightUpLeg",
        "translation": [
          0,
          -0.05,
          0.09
        ],
        "rotation": [
          0,
          0,
          0,
          1
        ],
        "scale": [
          1,
          1,
          1
        ]
      },
      {
        "name": "mixamorig:RightLeg",
        "translation": [
          0,
          -0.42,
          0
        ],
        "rotation": [
          0,
          0,
          0,
          1
        ],
        "scale": [
          1,
          1,
          1
        ]
      },
      {
        "name": "mixamorig:RightFoot",
        "translation": [
          0,
          -0.4,
          0
        ],
        "rotation": [
          0,
          0,
          0,
          1
        ],
        "scale": [
          1,
          1,
          1
        ]
      },
      {
        "name": "mixamorig:RightToeBase",